{
  "meta": {
    "schema_version": 1,
    "generated_at": "2026-09-28T22:23:16.738907+00:00",
    "method": "lexical-anchor-overlap-v1",
    "input_document_count": 1431,
    "input_changed_document_count": 1058,
    "cluster_count": 471,
    "overbroad_cluster_count": 0,
    "filtered_anchor_count": 169,
    "coherent_cluster_count": 191,
    "quality_eligible_cluster_count": 11,
    "explained_cluster_count": 127,
    "unexplained_quality_eligible_count": 1,
    "active_record_count": 1,
    "spark_count": 1,
    "candidate_count": 0,
    "merge_suggestion_count": 25,
    "disposition_counts": {
      "covered-by-existing-theme": 121,
      "merge-existing-direction": 6,
      "novel": 344
    },
    "interpretation": "Mechanically generated review leads; zero active records is a valid gated result, not a pipeline failure.",
    "baseline_cycle": false,
    "baseline_complete": true,
    "baseline_version": 1
  },
  "records": [
    {
      "id": "discovery:agent-control-loop-f09a926fa3",
      "cluster_id": "discovery:agent-control-loop-f09a926fa3",
      "title": "Agent control loop",
      "state": "spark",
      "observed_pattern": "Agent control loop recur across 2 independent records from 2 sources and 2 source families, alongside no recurrent established theme.",
      "hypothesis": "The recurring combination of Agent control loop may represent a distinct engineering direction rather than isolated implementations.",
      "why_now": "2 retained evidence records are new or materially changed in the current run.",
      "novelty": "No existing theme or tracked direction meets the configured coverage threshold for this cluster.",
      "evidence_ids": [
        "arxiv:2609.20804v1",
        "hn:49821438"
      ],
      "source_ids": [
        "arxiv",
        "hacker-news"
      ],
      "source_family_ids": [
        "attention",
        "research"
      ],
      "theme_ids": [
        "agent-harnesses",
        "coding-agents",
        "memory-context",
        "skills-integrations",
        "small-specialized-models"
      ],
      "concepts": [
        "Agent control loop"
      ],
      "alternative_explanations": [
        "The records may share vocabulary because they describe one release cycle or copied framing rather than a durable direction.",
        "The apparent connection may disappear when implementation details and counterexamples are reviewed."
      ],
      "confirmation_conditions": [
        "Independent source families repeat the pattern in a later weekly cycle.",
        "A technical artifact or production account demonstrates the combined pattern rather than naming it only."
      ],
      "invalidation_conditions": [
        "The evidence resolves to one syndicated event, publisher, or product campaign.",
        "No independent reinforcement appears before the Spark becomes dormant."
      ],
      "first_seen": "2026-09-17T17:58:07Z",
      "last_seen": "2026-09-23T19:42:58+00:00",
      "metrics": {
        "evidence_count": 2,
        "independent_event_count": 2,
        "source_count": 2,
        "source_family_count": 2,
        "technical_record_count": 1,
        "dominant_publisher_share": 0.5
      },
      "eligibility": {
        "decision": "eligible",
        "reason_codes": [
          "spark-gate-met",
          "novel",
          "structural-anchor",
          "anchor-support-met"
        ],
        "novelty_reviewed": false
      },
      "review": {
        "status": "pending",
        "action": null,
        "rationale": "",
        "target_id": ""
      },
      "proposed_disposition": "novel",
      "nearest_known": null,
      "materially_changed": true,
      "quality": {
        "anchor_support_share": 1.0,
        "anchor_support_met": true,
        "has_structural_anchor": true,
        "phrase_only": false,
        "entity_only": false,
        "recurrent_theme_count": 0,
        "context_coherence_met": true,
        "context_features": [
          {
            "id": "action:evaluate",
            "document_count": 2
          }
        ],
        "context_outlier_count": 0,
        "spark_quality_met": true,
        "candidate_quality_met": true
      }
    }
  ],
  "merge_suggestions": [
    {
      "cluster_id": "discovery:long-running-0b1aa70e84",
      "disposition": "merge-existing-direction",
      "nearest_known": {
        "kind": "early-signal-direction",
        "id": "modular-agent-stack",
        "title": "The agent stack is separating into modular operating layers",
        "theme_recall": 1.0,
        "matched_theme_ids": [
          "agent-harnesses",
          "assurance-infrastructure",
          "skills-integrations"
        ],
        "matched_anchor_ids": [],
        "matched_anchor_phrases": [],
        "basis": "recurrent-theme-recall"
      },
      "anchor_labels": [
        "long running"
      ],
      "evidence_ids": [
        "arxiv:2609.16305",
        "bluesky:1278ebf77949:3mv6cihd7tk2v",
        "bluesky:1278ebf77949:3mvxrv6krzs22",
        "openai-news:b32e9b847135398762b9"
      ],
      "source_count": 3,
      "source_family_count": 3,
      "materially_changed": true
    },
    {
      "cluster_id": "discovery:horizon-task-bbbaaee1cf",
      "disposition": "merge-existing-direction",
      "nearest_known": {
        "kind": "early-signal-direction",
        "id": "simulation-first-physical-ai",
        "title": "Simulation is becoming the development environment for physical AI",
        "theme_recall": 0.667,
        "matched_theme_ids": [
          "multimodal-3d",
          "robotics-embodied-ai"
        ],
        "matched_anchor_ids": [],
        "matched_anchor_phrases": [],
        "basis": "recurrent-theme-recall"
      },
      "anchor_labels": [
        "long horizon",
        "horizon task",
        "horizon tasks"
      ],
      "evidence_ids": [
        "arxiv:2609.20800v1",
        "arxiv:2609.21788v1",
        "hf-paper:2609.27308",
        "hf-paper:2609.28466",
        "yc-company:30923"
      ],
      "source_count": 3,
      "source_family_count": 2,
      "materially_changed": true
    },
    {
      "cluster_id": "discovery:confidential-computing-4ff4177a68",
      "disposition": "merge-existing-direction",
      "nearest_known": {
        "kind": "early-signal-direction",
        "id": "enterprise-data-boundary",
        "title": "Proprietary enterprise data is moving behind a governed model boundary",
        "theme_recall": 0.0,
        "matched_theme_ids": [],
        "matched_anchor_ids": [
          "primitive:confidential-computing"
        ],
        "matched_anchor_phrases": [],
        "basis": "explicit-anchor"
      },
      "anchor_labels": [
        "Confidential computing"
      ],
      "evidence_ids": [
        "arxiv:2609.20532v1",
        "arxiv:2609.21728v1",
        "nvidia-developer-blog:414469594f15a132e944"
      ],
      "source_count": 2,
      "source_family_count": 2,
      "materially_changed": true
    },
    {
      "cluster_id": "discovery:long-horizon-tool-using-b0604038be",
      "disposition": "merge-existing-direction",
      "nearest_known": {
        "kind": "early-signal-direction",
        "id": "modular-agent-stack",
        "title": "The agent stack is separating into modular operating layers",
        "theme_recall": 0.667,
        "matched_theme_ids": [
          "agent-harnesses",
          "assurance-infrastructure"
        ],
        "matched_anchor_ids": [],
        "matched_anchor_phrases": [],
        "basis": "recurrent-theme-recall"
      },
      "anchor_labels": [
        "long horizon tool using",
        "refusal-calibration",
        "sadia sigma lab blindspot",
        "sadia-sigma-lab/BLINDSPOT"
      ],
      "evidence_ids": [
        "arxiv:2609.16305",
        "github:1370498337"
      ],
      "source_count": 2,
      "source_family_count": 2,
      "materially_changed": true
    },
    {
      "cluster_id": "discovery:model-replaceability-24ff553ea4",
      "disposition": "merge-existing-direction",
      "nearest_known": {
        "kind": "early-signal-direction",
        "id": "modular-agent-stack",
        "title": "The agent stack is separating into modular operating layers",
        "theme_recall": 0.0,
        "matched_theme_ids": [],
        "matched_anchor_ids": [
          "primitive:model-replaceability"
        ],
        "matched_anchor_phrases": [],
        "basis": "explicit-anchor"
      },
      "anchor_labels": [
        "Model replaceability"
      ],
      "evidence_ids": [
        "arxiv:2609.20504v1",
        "yc-company:33969"
      ],
      "source_count": 2,
      "source_family_count": 2,
      "materially_changed": true
    },
    {
      "cluster_id": "discovery:data-sovereignty-5980424c41",
      "disposition": "merge-existing-direction",
      "nearest_known": {
        "kind": "early-signal-direction",
        "id": "enterprise-data-boundary",
        "title": "Proprietary enterprise data is moving behind a governed model boundary",
        "theme_recall": 0.0,
        "matched_theme_ids": [],
        "matched_anchor_ids": [
          "primitive:data-sovereignty"
        ],
        "matched_anchor_phrases": [
          "data sovereignty"
        ],
        "basis": "explicit-anchor"
      },
      "anchor_labels": [
        "Data sovereignty"
      ],
      "evidence_ids": [
        "aws-machine-learning-blog:5a658dac9f90bae77e02",
        "mistral-news:830fb9aa9b114f2dafe7"
      ],
      "source_count": 2,
      "source_family_count": 1,
      "materially_changed": true
    },
    {
      "cluster_id": "discovery:api-keys-c177b8ad02",
      "disposition": "covered-by-existing-theme",
      "nearest_known": {
        "kind": "theme",
        "id": "coding-agents",
        "title": "Coding agents & developer tooling",
        "document_share": 0.75,
        "matched_anchor_phrases": [],
        "basis": "document-share"
      },
      "anchor_labels": [
        "api keys"
      ],